<?xml version="1.0" encoding="UTF-8" ?>
<departments
  xmlns:xsi="http://www.w3.org/2001/XMLSchema-instance"
  xmlns="hr-model" 
  xsi:schemaLocation="hr-model hr-model.xsd">
  <department id="10">
    <name>Administration</name>
    <managerId>200</managerId>
    <locationId>1700</locationId>
  </department>
  <department id="20">
    <name>Marketing</name>
    <managerId>201</managerId>
    <locationId>1800</locationId>
  </department>
  <department id="30">
    <name>Purchasing</name>
    <managerId>114</managerId>
    <locationId>1700</locationId>
  </department>
  <department id="40">
    <name>Human Resources</name>
    <managerId>203</managerId>
    <locationId>2400</locationId>
  </department>
</departments>
